ID_Signo,Descripcion_Signo
SG01,"Aspecto pulverulento (polvillo blanco o cenizo sobre las lesiones)"
SG02,"Micelio blanco de aspecto algodonoso sobre tejidos acuosos"
SG03,"Esclerocios negros de tamaño irregular (dentro o fuera del tallo)"
SG04,"Rizomorfas blancas (micelio con aspecto de raíz que crece radialmente)"
SG05,"Esclerocios castaños esféricos (similares a semillas de colza)"
SG06,"Zooglea (suspensión blanquecina que emana del tallo al sumergirlo en agua)"
SG07,"Terciopelo de color marrón localizado en el envés de las hojas"
SG08,"Masa gelatinosa de color rosado sobre lesiones de frutos maduros"
SG09,"Guías de la maleza parásita envolviendo activamente la planta"